{
  "$schema": "http://json-schema.org/draft-04/schema",
  "type": "array",
  "required": true,
  "items": {
    "type": "object",
    "required": true,
    "properties": {
      "slug": {
        "type": "string",
        "required": true
      },
      "creator": {
        "type": "object",
        "required": true,
        "properties": {
          "name": {
            "type": "string",
            "required": true
          }
        }
      },
      "subject": {
        "type": "string",
        "required": true
      },
      "text": {
        "type": "string",
        "required": true
      },
      "createDate": {
        "type": "string",
        "required": true
      }
    }
  }
}