[
  {
    "slug": "second-news",
    "creator": {
      "name": "Admin"
    },
    "subject": "Second News",
    "text": "This is a second test news!",
    "createDate": "2016-06-19T15:59:25.054Z"
  },
  {
    "slug": "hello-world",
    "creator": {
      "name": "Admin"
    },
    "subject": "Hello World!",
    "text": "**This** is a **first** test news! `Welcome!`",
    "createDate": "2016-06-18T15:59:25.390Z"
  }
]